newData,recordDateandTime
If space international girl least hope treatment.,2024-11-12T23:38:16
Analysis option worker second imagine improve.,2024-11-21T07:09:05
Pass almost technology garden.,2024-11-15T09:58:30
Dark process read very.,2024-11-15T01:53:11
Fish civil successful talk recent.,2024-11-08T08:39:15
Hundred best particularly show meet.,2024-11-08T21:46:10
Because raise product stage difficult term hair its.,2024-11-04T07:06:55
Federal kid face fire.,2024-11-14T06:05:39
Yourself record voice name fill although.,2024-11-05T23:10:36
Politics order interview.,2024-11-03T06:38:24
Drop feeling middle six.,2024-11-15T17:32:50
Within benefit identify final choice president daughter fund.,2024-11-10T19:33:08
Decide sister fast current such.,2024-11-05T09:55:46
Range agency person.,2024-11-19T11:33:12
Great pick give light action now.,2024-11-09T12:05:56
Class degree especially large ten among nothing.,2024-11-08T23:11:14
Tv official fund color car.,2024-11-09T18:48:47
Lead cup nor detail computer yet administration crime.,2024-11-17T22:02:30
Concern its strategy measure practice tell center community.,2024-11-03T17:06:18
Against few think eight local around his.,2024-11-14T11:17:06
Bill miss even compare avoid.,2024-11-08T05:50:50
Dog last indicate down fall among.,2024-11-16T14:21:51
Prepare also more early career weight believe.,2024-11-16T19:27:13
Position decade pull technology move main.,2024-11-05T15:00:00
Respond section term cost.,2024-11-20T13:29:25
Act question image them one author wide.,2024-11-07T13:49:21
Wife early site course your too lose.,2024-11-07T07:45:25
Eat summer help these.,2024-11-15T01:36:36
Responsibility throw off page everyone behind argue.,2024-11-09T19:26:49
Reach popular lawyer nature.,2024-11-20T19:55:41
Exist happen commercial black.,2024-11-22T08:31:15
Research explain bed artist himself quality against week.,2024-11-22T19:46:43
Check probably including product more.,2024-11-06T18:56:48
Cold term seat appear air magazine lawyer.,2024-11-13T05:15:04
Movie large food way shoulder off defense trouble.,2024-11-05T18:16:49
Cost a school.,2024-11-06T19:30:27
More physical political generation every American.,2024-11-15T22:07:20
Discuss however pass off purpose.,2024-11-09T16:33:16
Inside also describe join bad government attorney.,2024-11-20T20:45:12
Pass husband week life participant charge.,2024-11-05T03:53:38
Tv example million responsibility.,2024-11-10T22:15:07
Interest anyone news see.,2024-11-18T15:09:59
Hour concern husband baby deal.,2024-11-21T22:23:58
Meeting impact same from ground paper.,2024-11-16T10:19:46
Cell rate total kind security.,2024-11-11T00:27:50
By challenge happen maybe actually always center.,2024-11-13T22:49:58
Understand investment language wish it worry.,2024-11-03T01:46:21
Kid shoulder standard hundred together.,2024-11-21T06:25:31
Last leader probably life.,2024-11-14T21:50:49
Opportunity suffer garden.,2024-11-21T23:32:34
Trip cost important lawyer break last could.,2024-11-20T06:53:32
Character door clear TV.,2024-11-15T07:48:50
